{
  "$schema": "../../schema/source-aliases.schema.json",
  "schema_version": "1.0",
  "namespace_uuid": "da11a1ce-2026-5eed-8b37-6db4bde33f3a",
  "normalization_version": "url-v1",
  "generated_from_commit": "bf0b6706c56d467029f6a0531230c8800ceb7fd6",
  "sources": [
    {
      "source_uid": "a5698ffe-90ea-5fc9-bc7e-b77d558cec5b",
      "identity_seed": "https://www.wired.com/story/jeff-dean-google-discovery-loop-startup",
      "canonical_url": "https://www.wired.com/story/jeff-dean-google-discovery-loop-startup",
      "aliases": [],
      "provider": null,
      "external_id": null,
      "merged_into_source_uid": null,
      "reason": "Deterministic UUIDv5 bootstrap from the normalized legacy URL."
    },
    {
      "source_uid": "384fa7fd-1805-5613-b874-6592d9042af4",
      "identity_seed": "https://www.businessinsider.com/jeff-dean-new-startup-discovery-loop-google-facts-2026-8",
      "canonical_url": "https://www.businessinsider.com/jeff-dean-new-startup-discovery-loop-google-facts-2026-8",
      "aliases": [],
      "provider": null,
      "external_id": null,
      "merged_into_source_uid": null,
      "reason": "Deterministic UUIDv5 bootstrap from the normalized legacy URL."
    },
    {
      "source_uid": "d6d0c41c-a2d1-5c80-be13-da348eddc256",
      "identity_seed": "https://ai.meta.com/blog/introducing-muse-spark-meta-model-api/",
      "canonical_url": "https://ai.meta.com/blog/introducing-muse-spark-meta-model-api/",
      "aliases": [],
      "provider": null,
      "external_id": null,
      "merged_into_source_uid": null,
      "reason": "Deterministic UUIDv5 bootstrap from the normalized legacy URL."
    },
    {
      "source_uid": "97099ab2-1138-5b04-87e0-0fdf09af77fb",
      "identity_seed": "https://apnews.com/article/0e8061437da6779be962b24ac134a514",
      "canonical_url": "https://apnews.com/article/0e8061437da6779be962b24ac134a514",
      "aliases": [],
      "provider": null,
      "external_id": null,
      "merged_into_source_uid": null,
      "reason": "Deterministic UUIDv5 bootstrap from the normalized legacy URL."
    },
    {
      "source_uid": "2634d013-775e-5b8a-9722-e766604b1dd3",
      "identity_seed": "https://digital-strategy.ec.europa.eu/en/faqs/transparency-obligations-under-article-50-ai-act",
      "canonical_url": "https://digital-strategy.ec.europa.eu/en/faqs/transparency-obligations-under-article-50-ai-act",
      "aliases": [],
      "provider": null,
      "external_id": null,
      "merged_into_source_uid": null,
      "reason": "Deterministic UUIDv5 bootstrap from the normalized legacy URL."
    },
    {
      "source_uid": "9f56b6d1-1461-585c-8e93-d33ce5065150",
      "identity_seed": "https://ai-act-service-desk.ec.europa.eu/en/faq",
      "canonical_url": "https://ai-act-service-desk.ec.europa.eu/en/faq",
      "aliases": [],
      "provider": null,
      "external_id": null,
      "merged_into_source_uid": null,
      "reason": "Deterministic UUIDv5 bootstrap from the normalized legacy URL."
    }
  ]
}
